id|faction_id|name|legend|description|detachment|
000009814|CD|Blood Tainted|Lifeblood spilt by the daemons of Khorne is tainted by their infernal touch, staining the ground dark with murder.|At the end of a phase in which a <span class="tooltip00368" data-tooltip-content="#tooltip_content00368" data-tooltip-anchor="#tooltip_content00368"><span class="kwb kwbu">LEGIONES</span> <span class="kwb kwbu">DAEMONICA</span> <span class="kwb kwbu">KHORNE</span></span> unit from your army destroyed an enemy unit that was within range of an <span class="tooltip00046" data-tooltip-content="#tooltip_content00046"><span class="tt kwbu">objective</span> <span class="tt kwbu">marker</span></span> at the start of the phase, if your unit has a higher Level of Control over that objective marker, that objective marker remains under your control until your opponent’s Level of Control over that objective marker is greater than yours at the end of a phase.|Blood Legion|
000009818|CD|Melancholic Miasma|To fight the daemons of Nurgle is to endure their entropic assaults upon both the physical and spiritual battlefields. The horror of inevitable decay claws at the souls of their victims even as the daemons’ splintered talons rake their flesh, heralding nightmarish putrefaction and impending doom. |While an enemy unit is within 9" of one or more <span class="tooltip00365" data-tooltip-content="#tooltip_content00365" data-tooltip-anchor="#tooltip_content00365"><span class="kwb kwbu">LEGIONES</span> <span class="kwb kwbu">DAEMONICA</span> <span class="kwb kwbu">NURGLE</span></span> units from your army, that enemy unit is within your army’s <span class="tooltip00286" data-tooltip-content="#tooltip_content00286"><span class="tt kwbu">Shadow</span> <span class="tt kwbu">of</span> <span class="tt kwbu">Chaos</span></span>. In each player’s <a href="/wh40k10ed/the-rules/core-rules/#COMMAND-PHASE">Command phase</a>, select one enemy unit within your army’s Shadow of Chaos. That unit must take a <span class="tooltip00021" data-tooltip-content="#tooltip_content00021"><span class="tt kwbu">Battle-shock</span> <span class="tt kwbu">test</span></span>.|Plague Legion|
000008362|CSM|Marks of Chaos||When mustering your army, when you select a <span class="kwb">HERETIC</span> <span class="kwb">ASTARTES</span> unit to include in your army, if that unit is not an <span class="tooltip00323" data-tooltip-content="#tooltip_content00323" data-tooltip-anchor="#tooltip_content00323"><span class="kwb kwbu">EPIC</span> <span class="kwb kwbu">HERO</span></span> and does not already have one of the following keywords, you must select one for that unit and note it on your Army Roster: <span class="tooltip00487" data-tooltip-content="#tooltip_content00487" data-tooltip-anchor="#tooltip_content00487"><span class="kwb kwbu">KHORNE</span></span>. <span class="tooltip00488" data-tooltip-content="#tooltip_content00488" data-tooltip-anchor="#tooltip_content00488"><span class="kwb kwbu">TZEENTCH</span></span>, <span class="tooltip00489" data-tooltip-content="#tooltip_content00489" data-tooltip-anchor="#tooltip_content00489"><span class="kwb kwbu">NURGLE</span></span>, <span class="tooltip00490" data-tooltip-content="#tooltip_content00490" data-tooltip-anchor="#tooltip_content00490"><span class="kwb kwbu">SLAANESH</span></span>, <span class="tooltip00491" data-tooltip-content="#tooltip_content00491" data-tooltip-anchor="#tooltip_content00491"><span class="kwb kwbu">CHAOS</span> <span class="kwb kwbu">UNDIVIDED</span></span>. Each time a unit with one of these keywords gains a weapon ability as the result of a <span class="tooltip00270" data-tooltip-content="#tooltip_content00270"><span class="tt kwbu">Dark</span> <span class="tt kwbu">Pact</span></span> and does not fail the resulting <span class="tooltip00091" data-tooltip-content="#tooltip_content00091"><span class="tt kwbu">Leadership</span> <span class="tt kwbu">test</span></span>, until the end of the phase, that unit gains the associated ability below.<br><br><span class="hi_custom">UNITS THAT GAINED <span class="kwb2 bluefont"><span class="tooltip00064" data-tooltip-content="#tooltip_content00064"><span class="tt kwbu">[LETHAL</span> <span class="tt kwbu">HITS]</span></span></span></span><br><ul><li><span class="kwb">KHORNE:</span> Each time a model in this unit makes a melee attack, an unmodified <span class="tooltip00011" data-tooltip-content="#tooltip_content00011"><span class="tt kwbu">Hit</span> <span class="tt kwbu">roll</span></span> of 5+ scores a <span class="tooltip00011" data-tooltip-content="#tooltip_content00011"><span class="tt kwbu">Critical</span> <span class="tt kwbu">Hit</span></span>.</li><li><span class="kwb">TZEENTCH:</span> Each time a model in this unit makes a ranged attack, an unmodified Hit roll of 5+ scores a Critical Hit.</li><li><span class="kwb">CHAOS</span> <span class="kwb">UNDIVIDED:</span> Each time a model in this unit makes an attack, re-roll a Hit  roll of 1.</li></ul><br><span class="hi_custom">UNITS THAT GAINED <span class="kwb2 bluefont"><span class="tooltip00033" data-tooltip-content="#tooltip_content00033"><span class="tt kwbu">[SUSTAINED</span> <span class="tt kwbu">HITS</span> <span class="tt kwbu">1]</span></span></span></span><br><ul><li><span class="kwb">NURGLE:</span> Each time a model in this unit makes a ranged attack, an unmodified Hit roll of 5+ scores a Critical Hit.</li><li><span class="kwb">SLAANESH:</span> Each time a model in this unit makes a melee attack, an unmodified Hit roll of 5+ scores a Critical Hit.</li><li><span class="kwb">CHAOS</span> <span class="kwb">UNDIVIDED:</span> Each time a model in this unit makes an attack, re-roll a Hit roll of 1.</li></ul><br><span class="hi_custom">RESTRICTIONS</span><br><ul><li>You cannot select the <span class="kwb">KHORNE</span> keyword for a <span class="tooltip00272" data-tooltip-content="#tooltip_content00272" data-tooltip-anchor="#tooltip_content00272"><span class="kwb kwbu">PSYKER</span></span> unit.</li><li>A <span class="tooltip00161" data-tooltip-content="#tooltip_content00161" data-tooltip-anchor="#tooltip_content00161"><span class="kwb kwbu">CHARACTER</span></span> unit can only be attached to a unit if both units share the same keyword from the list above.</li><li>A unit can only embark within (or start the battle embarked within) a <span class="kwb">TRANSPORT</span> if both of those units share the same keyword from the list above.</li></ul>|Pactbound Zealots|
000008959|CSM|Focus of Hatred|The eldest of the Chaos Space Marines harbour within their corrupted souls a burning desire for vengeance upon the Imperium and the galaxy as a whole.  They channel this ire against their chosen targets, relentlessly pursuing their victims until every last foe lies dead upon the battlefield. |At the start of your <a href="/wh40k10ed/the-rules/core-rules/#COMMAND-PHASE">Command phase</a>, select one unit from your opponents army to be your focus of hatred. Until the start of your next Command phase,  each time a <span class="kwb">HERETIC</span> <span class="kwb">ASTARTES</span> model from  your army (excluding <span class="tooltip00271" data-tooltip-content="#tooltip_content00271" data-tooltip-anchor="#tooltip_content00271"><span class="kwb kwbu">DAMNED</span></span> models) makes an attack that targets your focus of hatred, you can re-roll the <span class="tooltip00011" data-tooltip-content="#tooltip_content00011"><span class="tt kwbu">Hit</span> <span class="tt kwbu">roll</span></span>.|Veterans of the Long War|
000008963|CSM|Masters of Misdirection|There are those warbands that number amongst their ranks liars, schemers and infiltrators of far more prodigious skill than most heretics. Employing labyrinthine ploys, they unnerve their enemies and force them to chase ghosts and shadows. They embed themselves within combat zones long before showing their hand, seeding Chaos cults, identifying key targets and feeding misinformation to their foes.|In the <a href="/wh40k10ed/the-rules/core-rules/#Declare-Battle-Formations">Declare Battle Formations</a> step, you can select a number of <a class="kwbOne" href="/wh40k10ed/factions/chaos-space-marines/Legionaries"><span class="kwb kwbo">LEGIONARIES</span></a> and <a class="kwbOne" href="/wh40k10ed/factions/chaos-space-marines/Cultist-Mob"><span class="kwb kwbo">CULTIST</span> <span class="kwb kwbo">MOB</span></a> units from your army: <br>until the end of the battle, those units, and any <span class="tooltip00161" data-tooltip-content="#tooltip_content00161" data-tooltip-anchor="#tooltip_content00161"><span class="kwb kwbu">CHARACTER</span></span> units <span class="tooltip00037" data-tooltip-content="#tooltip_content00037"><span class="tt kwbu">attached</span></span> to them (excluding <span class="tooltip00323" data-tooltip-content="#tooltip_content00323" data-tooltip-anchor="#tooltip_content00323"><span class="kwb kwbu">EPIC</span> <span class="kwb kwbu">HEROES</span></span>), have the <span class="tooltip00051" data-tooltip-content="#tooltip_content00051"><span class="tt kwbu">Infiltrators</span></span> ability. The maximum number of units you can select in this way depends on the battle size, as shown below.<br><div class="BreakInsideAvoid"  style="""><table width="0" border="0" bordercolor="#888" cellpadding="4" cellspacing="0" style="border-collapse:collapse;border-width:0px"><tbody><tr><td><table class=" customTable tablefont" border="1" bordercolor="#888" cellpadding="4" style="border-collapse:collapse;border-color:#888888;border-width:0px"><tbody><tr><td rowspan="2" style="border-width:1px 1px 1px 1px;border-style:none none dotted none;background-color:rgb(57,75,87);color:rgb(254,254,254);text-align:center;vertical-align:middle;font-size:20px;width:160px;height:30px;"><b>BATTLE SIZE</b></td><td colspan="2" style="border-width:1px 0 0 1px;border-style:none none none none;background-color:rgb(57,75,87);color:rgb(254,254,254);text-align:center;vertical-align:middle;font-size:20px;width:0px;height:0px;"><b>NUMBER OF UNITS</b></td></tr><tr><td style="border-width:1px 0 0 1px;border-style:none none none none;background-color:rgb(57,75,87);color:rgb(254,254,254);text-align:center;vertical-align:middle;font-size:20px;width:136px;height:30px;"><b>LEGIONARIES</b></td><td style="border-width:1px 0 0 0;border-style:none none none none;background-color:rgb(57,75,87);color:rgb(254,254,254);text-align:center;vertical-align:middle;font-size:20px;width:128px;height:30px;"><b>CULTIST MOBS</b></td></tr><tr><td style="border-width:1px 1px 1px 1px;border-style:none none dotted none;text-align:center;vertical-align:middle;font-size:18px;width:160px;height:0px;">Incursion </td><td style="border-width:1px 1px 1px 1px;border-style:none none dotted none;text-align:center;vertical-align:middle;font-size:18px;width:136px;height:0px;"><b>Up to 2 units </b></td><td style="border-width:1px 1px 1px 1px;border-style:none none dotted none;text-align:center;vertical-align:middle;font-size:18px;width:128px;height:0px;"><b>Up to 2 units </b></td></tr><tr><td style="border-width:1px 1px 1px 1px;border-style:none none dotted none;text-align:center;vertical-align:middle;font-size:18px;width:160px;height:0px;">Strike Force</td><td style="border-width:1px 1px 1px 1px;border-style:none none dotted none;text-align:center;vertical-align:middle;font-size:18px;width:136px;height:0px;"><b>Up to 3 units </b></td><td style="border-width:1px 1px 1px 1px;border-style:none none dotted none;text-align:center;vertical-align:middle;font-size:18px;width:128px;height:0px;"><b>Up to 3 units </b></td></tr><tr><td style="border-width:1px 1px 1px 1px;border-style:none none dotted none;text-align:center;vertical-align:middle;font-size:18px;width:160px;height:0px;">Onslaught</td><td style="border-width:1px 1px 1px 1px;border-style:none none dotted none;text-align:center;vertical-align:middle;font-size:18px;width:136px;height:0px;"><b>Up to 4 units </b></td><td style="border-width:1px 1px 1px 1px;border-style:none none dotted none;text-align:center;vertical-align:middle;font-size:18px;width:128px;height:0px;"><b>Up to 4 units </b></td></tr></tbody></table></td></tr></tbody></table></div>|Deceptors|
000008967|CSM|Raiders and Reavers|Some Heretic Astartes warbands are piratical by nature, launching swift attacks focused upon destroying their foes in a storm of bloody violence, seizing territory and spoils of war before the enemy can bring reinforcements to bear.|Ranged weapons equipped by <span class="kwb">HERETIC</span> <span class="kwb">ASTARTES</span> models from your army have the <span class="kwb2 bluefont"><span class="tooltip00077" data-tooltip-content="#tooltip_content00077"><span class="tt kwbu">[ASSAULT]</span></span></span> ability, and each time a <span class="kwb">HERETIC</span> <span class="kwb">ASTARTES</span> model from your army makes an attack that targets a unit within range of an <span class="tooltip00046" data-tooltip-content="#tooltip_content00046"><span class="tt kwbu">objective</span> <span class="tt kwbu">marker</span></span>, improve the Armour Penetration characteristic of that attack by 1.|Renegade Raiders|
000008971|CSM|Terror Descends (Aura)|Bedecked in the flayed skins and leering skulls of former victims, their armour flecked with blood and gore, these reavers descend in a howling gale of enraged screams and soul-piercing shrieks. To look upon their ghastly visages is to feel a terrible and paralysing fear.|In the <span class="tooltip00021" data-tooltip-content="#tooltip_content00021"><span class="tt kwbu">Battle-shock</span></span> step of your opponent’s <a href="/wh40k10ed/the-rules/core-rules/#COMMAND-PHASE">Command phase</a>, if an enemy unit that is below its <span class="tooltip00059" data-tooltip-content="#tooltip_content00059"><span class="tt kwbu">Starting</span> <span class="tt kwbu">Strength</span></span> is within 12" of one or more <span class="kwb">HERETIC</span> <span class="kwb">ASTARTES</span> units from your army, that enemy unit must take a <span class="tooltip00021" data-tooltip-content="#tooltip_content00021"><span class="tt kwbu">Battle-shock</span> <span class="tt kwbu">test</span></span>. <br><br>Each time an enemy unit within 12" of one or more <span class="kwb">HERETIC</span> <span class="kwb">ASTARTES</span> units from your army takes a Battle-shock test, subtract 1 from the result. <br><br>Enemy units affected by this Detachment rule do not need to take any other <span class="tooltip00021" data-tooltip-content="#tooltip_content00021"><span class="tt kwbu">Battle-shock</span> <span class="tt kwbu">tests</span></span> in the same phase.|Dread Talons|
000008975|CSM|Iron Fortitude|The most indefatigable of Heretic Astartes warbands possess a grim determination that matches the resilience of their superhuman physiques and formidable ceramite armour. They go to war amidst formations of daemonic war machines and growling vehicles. Some even embrace the worship of the Dark Gods, trading their souls for supernatural protection. |Each time a ranged attack targets a <span class="kwb">HERETIC</span> <span class="kwb">ASTARTES</span> unit from your army (excluding <span class="tooltip00271" data-tooltip-content="#tooltip_content00271" data-tooltip-anchor="#tooltip_content00271"><span class="kwb kwbu">DAMNED</span></span> units), if the Strength characteristic of that attack is greater than the Toughness characteristic of that unit, subtract 1 from the <span class="tooltip00023" data-tooltip-content="#tooltip_content00023"><span class="tt kwbu">Wound</span> <span class="tt kwbu">roll</span></span>.|Fellhammer Siege-host|
000008979|CSM|Desperate Devotion|Utterly dedicated to the worship of the Dark Gods, thronging mortal cultists and regiments of Traitor Guardsmen are more than willing to make bloody sacrifices and take desperate actions in the hope of attaining favour.|Each time a <span class="tooltip00271" data-tooltip-content="#tooltip_content00271" data-tooltip-anchor="#tooltip_content00271"><span class="kwb kwbu">DAMNED</span></span> unit from your army with the <span class="tooltip00270" data-tooltip-content="#tooltip_content00270"><span class="tt kwbu">Dark</span> <span class="tt kwbu">Pacts</span></span> ability is selected to make a <span class="tooltip00006" data-tooltip-content="#tooltip_content00006"><span class="tt kwbu">Normal</span></span> or <span class="tooltip00007" data-tooltip-content="#tooltip_content00007"><span class="tt kwbu">Advance</span> <span class="tt kwbu">move</span></span> or <a href="/wh40k10ed/the-rules/core-rules/#CHARGE-PHASE">declare a charge</a> (excluding units that arrived from <a href="/wh40k10ed/the-rules/core-rules/#2.-Reinforcements">Reserves</a> this turn), it can make a Desperate Pact (see below). If it does, until the end of the phase, add 2 to the Move characteristic of models in that unit and add 2 to <span class="tooltip00009" data-tooltip-content="#tooltip_content00009"><span class="tt kwbu">Charge</span> <span class="tt kwbu">rolls</span></span> made for that unit. <br><br><span class="hi_custom">Desperate Pacts</span><br>Each time a unit makes a Desperate Pact, it must first take a <span class="tooltip00091" data-tooltip-content="#tooltip_content00091"><span class="tt kwbu">Leadership</span> <span class="tt kwbu">test</span></span>; if that test is failed, that unit suffers D3 <span class="tooltip00047" data-tooltip-content="#tooltip_content00047"><span class="tt kwbu">mortal</span> <span class="tt kwbu">wounds</span></span> before any effects of that Desperate Pact are resolved.|Chaos Cult|
000008980|CSM|KEYWORDS||<a class="kwbOne" href="/wh40k10ed/factions/chaos-space-marines/Traitor-Guardsmen-Squad"><span class="kwb kwbo">TRAITOR</span> <span class="kwb kwbo">GUARDSMEN</span> <span class="kwb kwbo">SQUAD</span></a> units from your army gain the <span class="tooltip00492" data-tooltip-content="#tooltip_content00492" data-tooltip-anchor="#tooltip_content00492"><span class="kwb kwbu">BATTLELINE</span></span> keyword.|Chaos Cult|
000008984|CSM|Debt to the Soul Forge|Many are the daemons who have forged pacts with Vashtorr the Arkifane. Once bound into such a contract, a soul debt must be paid, one that the daemon strives endlessly, and with all its desperation, to fulfil.|Each time a <span class="tooltip00316" data-tooltip-content="#tooltip_content00316" data-tooltip-anchor="#tooltip_content00316"><span class="kwb kwbu">HERETIC</span> <span class="kwb kwbu">ASTARTES</span> <span class="kwb kwbu">DAEMON</span> <span class="kwb kwbu">VEHICLE</span></span> unit from your army makes a <span class="tooltip00270" data-tooltip-content="#tooltip_content00270"><span class="tt kwbu">Dark</span> <span class="tt kwbu">Pact</span></span>, it can invoke its contract. If it does, subtract 1 from the resulting <span class="tooltip00091" data-tooltip-content="#tooltip_content00091"><span class="tt kwbu">Leadership</span> <span class="tt kwbu">test</span></span> when making that Dark Pact, and until the end of the phase:<br><ul><li>Each time a model in that unit makes a ranged attack, add 1 to the <span class="tooltip00023" data-tooltip-content="#tooltip_content00023"><span class="tt kwbu">Wound</span> <span class="tt kwbu">roll</span></span>. </li><li>Add 2 to the Attacks characteristic of melee weapons equipped by models in that unit.</li></ul>|Soulforged Warpack|
000009502|CSM|Dark Rewards|By swearing their souls to malefic warp powers, the most debased and powerful of the warband may be granted knowledge and foresight beyond the ken of mere mortals.|Each lime a <span class="kwb">HERETIC</span> <span class="kwb">ASTARTES</span> unit from your army takes a <span class="tooltip00091" data-tooltip-content="#tooltip_content00091"><span class="tt kwbu">Leadership</span> <span class="tt kwbu">test</span></span> for the <span class="tooltip00270" data-tooltip-content="#tooltip_content00270"><span class="tt kwbu">Dark</span> <span class="tt kwbu">Pacts</span></span> ability, on a 9+, you gain 1CP.|Infernal Reavers|
000009511|CSM|Fanatical Onslaught|Knowing their only options are victory or death, the heretic hordes pack corridors with their bodies as they surge forward into the teeth of the enemy guns like a zealous food tide.|In your opponent’s <a href="/wh40k10ed/the-rules/boarding-action-rules/#Shooting-Phase">Shooting phase</a>, each time an enemy unit has shot, if one or more models from one or more <span class="kwb">HERETIC</span> <span class="kwb">ASTARTES</span> units from your army were <span class="tooltip00080" data-tooltip-content="#tooltip_content00080"><span class="tt kwbu">destroyed</span></span> as a result of those attacks, each such unit can make a Rush move. To do so, that unit can be moved up to 3", but must end that move as close as possible to the attacking unit. When doing so, those models can be moved within <a href="/wh40k10ed/the-rules/boarding-action-rules/#Engagement-Range">Engagement Range</a> of enemy units. A unit cannot make a Rush move while it is <span class="tooltip00021" data-tooltip-content="#tooltip_content00021"><span class="tt kwbu">Battle-shocked</span></span>, and can only make one Rush move per turn.|Underdeck Uprising|
000009519|CSM|Dark Purpose|Once they have set themselves to the task of conquest, warriors such as these neither hesitate nor turn aside.|Each time a <span class="kwb">HERETIC</span> <span class="kwb">ASTARTES</span> unit from your army <span class="tooltip00015" data-tooltip-content="#tooltip_content00015"><span class="tt kwbu">Consolidates</span></span>, if it is not within <a href="/wh40k10ed/the-rules/boarding-action-rules/#Engagement-Range">Engagement Range</a> of one or more enemy units, then until the end of the phase, each time a model in that unit makes a <span class="tooltip00015" data-tooltip-content="#tooltip_content00015"><span class="tt kwbu">Consolidation</span> <span class="tt kwbu">move</span></span>, it can move towards the closest <a href="/wh40k10ed/the-rules/boarding-action-rules/#Objective-Markers">objective marker</a>, but only if, after all models have done so, that unit is within range of that objective marker and in <span class="tooltip00104" data-tooltip-content="#tooltip_content00104"><span class="tt kwbu">Unit</span> <span class="tt kwbu">Coherency</span></span>.|Champions of Chaos|
