id|faction_id|name|legend|description|detachment|
000008393|AC|Martial Mastery|The Custodians have perfected countless ways of making war, be it on a personal, tactical or strategic scale.|At the start of the <a href="/wh40k10ed/the-rules/core-rules/#The-Battle-Round">battle round</a>, you can select one of the bullet points below. If you do, until the start of the next battle round, that bullet point’s effects apply.<br><ul><li>Each time an <span class="tooltip00327" data-tooltip-content="#tooltip_content00327" data-tooltip-anchor="#tooltip_content00327"><span class="kwb kwbu">ADEPTUS</span> <span class="kwb kwbu">CUSTODES</span></span> model from your army with the <span class="tooltip00294" data-tooltip-content="#tooltip_content00294"><span class="tt kwbu">Martial</span> <span class="tt kwbu">Ka’tah</span></span> ability makes a melee attack, a successful unmodified <span class="tooltip00011" data-tooltip-content="#tooltip_content00011"><span class="tt kwbu">Hit</span> <span class="tt kwbu">roll</span></span> of 5+ scores a <span class="tooltip00011" data-tooltip-content="#tooltip_content00011"><span class="tt kwbu">Critical</span> <span class="tt kwbu">Hit</span></span>.</li><li>Improve the Armour Penetration characteristic of melee weapons equipped by <span class="kwb">ADEPTUS</span> <span class="kwb">CUSTODES</span> models from your army with the Martial Ka’tah ability by 1.</li></ul>|Shield Host|
000008920|AC|Revered Companions|The Custodians and the Silent Sisters often fought as one during the earliest days of the Imperium. Ten thousand years on, they have lost none of the unity of doctrine and purpose that makes them such a deadly combination.|<span class="tooltip00325" data-tooltip-content="#tooltip_content00325" data-tooltip-anchor="#tooltip_content00325"><span class="kwb kwbu">ANATHEMA</span> <span class="kwb kwbu">PSYKANA</span></span> units from your army gain the following the ability:<br><br><b>Null Aegis (Aura):</b> While an <span class="tooltip00327" data-tooltip-content="#tooltip_content00327" data-tooltip-anchor="#tooltip_content00327"><span class="kwb kwbu">ADEPTUS</span> <span class="kwb kwbu">CUSTODES</span></span> unit is within 6" of this unit, models in that unit have the <span class="tooltip00073" data-tooltip-content="#tooltip_content00073"><span class="tt kwbu">Feel</span> <span class="tt kwbu">No</span> <span class="tt kwbu">Pain</span> <span class="tt kwbu">5+</span></span> ability against <span class="tooltip00031" data-tooltip-content="#tooltip_content00031"><span class="tt kwbu">Psychic</span> <span class="tt kwbu">Attacks</span></span> and <span class="tooltip00047" data-tooltip-content="#tooltip_content00047"><span class="tt kwbu">mortal</span> <span class="tt kwbu">wounds</span></span>.<br><br>All other <span class="kwb">ADEPTUS</span> <span class="kwb">CUSTODES</span> units from your army gain the following ability:<br><br><b>Deadly Unity (Aura):</b> While an <span class="kwb">ANATHEMA</span> <span class="kwb">PSYKANA</span> unit is within 6" of this unit, each time a model in that <span class="kwb">ANATHEMA</span> <span class="kwb">PSYKANA</span> unit makes an attack, add 1 to the <span class="tooltip00011" data-tooltip-content="#tooltip_content00011"><span class="tt kwbu">Hit</span> <span class="tt kwbu">roll</span></span>.|Talons Of The Emperor|
000008924|AC|Creeping Dread (Aura)|The instinctive fear caused by the Pariah gene spreads like a terrible pall before the cadres of the Silent Sisterhood.|In the <span class="tooltip00021" data-tooltip-content="#tooltip_content00021"><span class="tt kwbu">Battle-shock</span></span> step of your opponent’s <a href="/wh40k10ed/the-rules/core-rules/#COMMAND-PHASE">Command phase</a>, if an enemy unit that is either a <span class="kwb">PSYKER</span> unit or below its <span class="tooltip00059" data-tooltip-content="#tooltip_content00059"><span class="tt kwbu">Starting</span> <span class="tt kwbu">Strength</span></span> is within 12" of one or more <span class="tooltip00325" data-tooltip-content="#tooltip_content00325" data-tooltip-anchor="#tooltip_content00325"><span class="kwb kwbu">ANATHEMA</span> <span class="kwb kwbu">PSYKANA</span></span> models from your army, that enemy unit must take a <span class="tooltip00021" data-tooltip-content="#tooltip_content00021"><span class="tt kwbu">Battle-shock</span> <span class="tt kwbu">test</span></span>. If that unit is <span class="tooltip00053" data-tooltip-content="#tooltip_content00053"><span class="tt kwbu">Below</span> <span class="tt kwbu">Half-strength</span></span>, it must subtract 1 from its Battle-shock test this phase instead.<br><br><b>Designer’s Note:</b> <i>This means that all enemy <span class="kwb">PSYKER</span> units within range of this <span class="tooltip00383" data-tooltip-content="#tooltip_content00383"><span class="tt kwbu">Aura</span> <span class="tt kwbu">ability</span></span> and all enemy units within range of this Aura ability that have lost one or more models must take a Battle-shock test in your opponents Command phase, not just those that are Below Half-strength.</i>|Null Maiden Vigil|
000008925|AC|KEYWORDS||If you select this Detachment, <a class="kwbOne" href="/wh40k10ed/factions/adeptus-custodes/Prosecutors"><span class="kwb kwbo">PROSECUTORS</span></a> units from your army have the <span class="kwb">BATTLELINE</span> keyword.|Null Maiden Vigil|
000008929|AC|Assemblage of Might|When such exceptional warriors as these gather to quest in the Emperors name, even the most dreadful foes of Humanity are right to fear for their lives.|At the start of your <a href="/wh40k10ed/the-rules/core-rules/#COMMAND-PHASE">Command phase</a>, select one unit from your opponent’s army. Until the start of your next Command phase, each time a model in an <span class="tooltip00478" data-tooltip-content="#tooltip_content00478" data-tooltip-anchor="#tooltip_content00478"><span class="kwb kwbu">ADEPTUS</span> <span class="kwb kwbu">CUSTODES</span> <span class="kwb kwbu">CHARACTER</span></span> unit from your army makes an attack that targets that enemy unit, add 1 to the <span class="tooltip00023" data-tooltip-content="#tooltip_content00023"><span class="tt kwbu">Wound</span> <span class="tt kwbu">roll</span></span>.|Auric Champions|
000009263|AC|Overwhelming Magnificence|To confront the towering, auramite-clad warriors of the Adeptus Custodes across an open battlefield is terrifying enough. To meet them in the cramped confines of a voidship is so overwhelming as to render many foes witless.|While an enemy unit is within <a href="/wh40k10ed/the-rules/boarding-action-rules/#Engagement-Range">Engagement Range</a> of one or more <span class="kwb">ADEPTUS</span> <span class="kwb">CUSTODES</span> units from your army, subtract 1 from the Objective Control characteristic of models in that enemy unit.|Voyagers in Darkness|
000009272|AC|Priority Quarry|With merciless efficiency, the Sisters of Silence mark their priority prey amidst the maelstrom of shiphoard combat, then focus on their elimination above all else.|At the start of the first <a href="/wh40k10ed/the-rules/core-rules/#The-Battle-Round">battle round</a>, you can select up to two enemy units to be your army’s quarry, one of which must be your opponents <span class="kwb">WARLORD</span>. Each time an <span class="tooltip00325" data-tooltip-content="#tooltip_content00325" data-tooltip-anchor="#tooltip_content00325"><span class="kwb kwbu">ANATHEMA</span> <span class="kwb kwbu">PSYKANA</span></span> unit from your army makes an attack that targets one of your army’s quarries, re-roll a <span class="tooltip00011" data-tooltip-content="#tooltip_content00011"><span class="tt kwbu">Hit</span> <span class="tt kwbu">roll</span></span> of 1. Each time an <span class="kwb">ANATHEMA</span> <span class="kwb">PSYKANA</span> unit from your army <span class="tooltip00009" data-tooltip-content="#tooltip_content00009"><span class="tt kwbu">declares</span> <span class="tt kwbu">a</span> <span class="tt kwbu">charge</span></span>, it can include one or more of your army’s quarries as targets of that charge, even if they are not <a href="/wh40k10ed/the-rules/core-rules/#Determining-Visibility">visible</a> to it.|Black Ship Guardians|
000009752|AC|Auric Armour|The venerable war engines of the Adeptus Custodes possess aggressive machine spirits.|<ul><li>While an <span class="tooltip00329" data-tooltip-content="#tooltip_content00329" data-tooltip-anchor="#tooltip_content00329"><span class="kwb kwbu">ADEPTUS</span> <span class="kwb kwbu">CUSTODES</span> <span class="kwb kwbu">VEHICLE</span></span> unit from your army is at <span class="tooltip00059" data-tooltip-content="#tooltip_content00059"><span class="tt kwbu">Starting</span> <span class="tt kwbu">Strength</span></span>, unless that unit is an <span class="tooltip00479" data-tooltip-content="#tooltip_content00479" data-tooltip-anchor="#tooltip_content00479"><span class="kwb kwbu">AIRCRAFT</span></span> or it is <span class="tooltip00021" data-tooltip-content="#tooltip_content00021"><span class="tt kwbu">Battle-shocked</span></span>, add 2 to the Objective Control characteristic of models in that unit.</li><li>While an <span class="kwb">ADEPTUS</span> <span class="kwb">CUSTODES</span> <span class="kwb">VEHICLE</span> unit from your army is below Starting Strength, each time a model in that unit makes an attack, re-roll a <span class="tooltip00011" data-tooltip-content="#tooltip_content00011"><span class="tt kwbu">Hit</span> <span class="tt kwbu">roll</span></span> of 1.</li><li>While an <span class="kwb">ADEPTUS</span> <span class="kwb">CUSTODES</span> <span class="kwb">VEHICLE</span> unit from your army is <span class="tooltip00053" data-tooltip-content="#tooltip_content00053"><span class="tt kwbu">Below</span> <span class="tt kwbu">Half-strength</span></span>, each time a model in that unit makes an attack, re-roll a Hit roll of 1 and re-roll a <span class="tooltip00023" data-tooltip-content="#tooltip_content00023"><span class="tt kwbu">Wound</span> <span class="tt kwbu">roll</span></span> of 1.</li></ul><br><span class="hi_custom">MORITOI ANCIENTS</span><br><p class="ShowFluff legend2">The Adeptus Custodes’ honoured fallen are ever eager for battle.</p>Add 2" to the Move characteristic of models in <span class="kwb">ADEPTUS</span> <span class="kwb">CUSTODES</span> <span class="kwb">WALKER</span> units from your army and add 1 to <span class="tooltip00007" data-tooltip-content="#tooltip_content00007"><span class="tt kwbu">Advance</span></span> and <span class="tooltip00009" data-tooltip-content="#tooltip_content00009"><span class="tt kwbu">Charge</span> <span class="tt kwbu">rolls</span></span> made for such units.<br><br><span class="hi_custom">KEYWORDS</span><br>In the Muster Armies step, you can select up to 2 <span class="kwb">ADEPTUS</span> <span class="kwb">CUSTODES</span> <span class="kwb">WALKER</span> models from your army. The selected units gain the <span class="kwb">CHARACTER</span> keyword.<br><br><b>Designer’s Note:</b> <i>This means that the selected models can be given Enhancements and one of them can be selected as your <span class="kwb">WARLORD</span>.</i>|Solar Spearhead|
000008384|AdM|Rad-bombardment|Whether as a result of natural phenomena, apocalyptic internecine strife or calamitous accidents, many forge worlds are heavily irradiated. When holy wars of requisition are unleashed, the Tech-Priests think nothing of turning this invisible curse upon their foes, bombarding the battlefield with deadly radiation prior to an assault.|<div class="whiteDiamondLine">BATTLE ROUND<div class="whiteDiamondWrap"><div class="redDiamondSpan"><div class="whiteDiamondSpan"><div class="whiteDiamondText">1</div></div></div></div></div><span class="hi_custom">BOMBARDMENT</span><br>At the start of the first <a href="/wh40k10ed/the-rules/core-rules/#The-Battle-Round">battle round</a>, for each enemy unit within your opponents deployment zone, your opponent must decide whether that unit will take cover or stand firm. You then roll one D6 for each of those enemy units and apply the relevant result below:<br><ul><li><b>Unit Standing Firm:</b> On a 3+, that unit suffers D3 <span class="tooltip00047" data-tooltip-content="#tooltip_content00047"><span class="tt kwbu">mortal</span> <span class="tt kwbu">wounds</span></span>.</li><li><b>Unit Taking Cover:</b> Until the end of the battle round, that unit is <span class="tooltip00021" data-tooltip-content="#tooltip_content00021"><span class="tt kwbu">Battle-shocked</span></span> and, on a 5+, that unit suffers D3 mortal wounds.</li></ul><br><div class="whiteDiamondLine">BATTLE ROUND<div class="whiteDiamondWrap"><div class="redDiamondSpan"><div class="whiteDiamondSpan"><div class="whiteDiamondText">2</div></div></div></div>     &emsp;&emsp;&nbsp;&nbsp;&nbsp;&nbsp;ONWARDS</div><span class="hi_custom">FALLOUT</span><br>At the start of your <a href="/wh40k10ed/the-rules/core-rules/#COMMAND-PHASE">Command phase</a> during the second, third, fourth and fifth battle rounds, roll one D6 for each enemy unit within your opponent’s deployment zone. On a 3+, that unit suffers 1 mortal wound and must take a Battle-shock test.|Rad-Zone Corps|
000008559|AdM|Stealth Optimisation|Hunter Cohorts combine a mastery of stealth warfare and cogitational analysis with stealth screen projectors and target-fouling apparatuses. They are elusive foes to face, and especially sinister to those they have designated as prey.|<span class="tooltip00132" data-tooltip-content="#tooltip_content00132" data-tooltip-anchor="#tooltip_content00132"><span class="kwb kwbu">SKITARII</span> <span class="kwb kwbu">INFANTRY</span></span>, <span class="tooltip00480" data-tooltip-content="#tooltip_content00480" data-tooltip-anchor="#tooltip_content00480"><span class="kwb kwbu">SKITARII</span> <span class="kwb kwbu">MOUNTED</span></span> and <a class="kwbOne" href="/wh40k10ed/factions/adeptus-mechanicus/Ironstrider-Ballistarii"><span class="kwb kwbo">IRONSTRIDER</span> <span class="kwb kwbo">BALLISTARII</span></a> units from your army have the <span class="tooltip00096" data-tooltip-content="#tooltip_content00096"><span class="tt kwbu">Stealth</span></span> ability, and each time a ranged attack targets a <span class="tooltip00481" data-tooltip-content="#tooltip_content00481" data-tooltip-anchor="#tooltip_content00481"><span class="kwb kwbu">SICARIAN</span></span> unit from your army, unless the attacking model is within 12", the target has the <span class="tooltip00043" data-tooltip-content="#tooltip_content00043"><span class="tt kwbu">Benefit</span> <span class="tt kwbu">of</span> <span class="tt kwbu">Cover</span></span> against that attack.|Skitarii Hunter Cohort|
000008563|AdM|Benedictions Of The Omnissiah|The Tech-Priests of the Omnissiah lead their disciples in a cortege of war. The buzz of static psalms chanted in synchronicity unites all in the stately eradication of the heretic and blasphemer.|At the start of the first <a href="/wh40k10ed/the-rules/core-rules/#The-Battle-Round">battle round</a>, select one of the following Benedictions of the Omnissiah to be active for <span class="tooltip00333" data-tooltip-content="#tooltip_content00333" data-tooltip-anchor="#tooltip_content00333"><span class="kwb kwbu">CULT</span> <span class="kwb kwbu">MECHANICUS</span></span> units from your army until the end of the battle:<br><br><span class="hi_custom">Panegyric Procession</span><br>Each time a <span class="kwb">CULT</span> <span class="kwb">MECHANICUS</span> model from your army makes a ranged attack that targets a unit within half range, improve the Armour Penetration characteristic of that attack by 1.<br><br><span class="hi_custom">Citation in Savagery</span><br>Each time a <span class="kwb">CULT</span> <span class="kwb">MECHANICUS</span> unit from your army is selected to fight, if that unit made a <span class="tooltip00009" data-tooltip-content="#tooltip_content00009"><span class="tt kwbu">Charge</span> <span class="tt kwbu">move</span></span> this turn, until the end of the phase, add 1 to the Strength and Attacks characteristics of melee weapons equipped by models in that unit.|Data-Psalm Conclave|
000008567|AdM|Acquisition At Any Cost|In their eternal quest for the acquisition of knowledge and technology, Tech-Priests require superhuman efforts from the troops under their command.|At the start of your <a href="/wh40k10ed/the-rules/core-rules/#COMMAND-PHASE">Command phase</a>, select one <span class="tooltip00046" data-tooltip-content="#tooltip_content00046"><span class="tt kwbu">objective</span> <span class="tt kwbu">marker</span></span>. Until the start of your next Command phase, that objective marker is your Acquisition objective marker. Each time an <span class="kwb">ADEPTUS</span> <span class="kwb">MECHANICUS</span> model from your army makes an attack, if that model’s unit is within range of your Acquisition objective marker, or if the target of that attack is within range of your Acquisition objective marker, re-roll a <span class="tooltip00023" data-tooltip-content="#tooltip_content00023"><span class="tt kwbu">Wound</span> <span class="tt kwbu">roll</span></span> of 1.|Explorator Maniple|
000008571|AdM|Cyber-Psalm Programming|In advance of a Cohort Cyberneticas battles, the Legios most talented Datasmiths will feed dogmatic auto-scripture into the programming cores of their robotic charges, as well as oracular schematics and tactical hymnals that delineate the strategy to come. So blessed, the Cohorts robots add their own grinding chants of static to a systematic chorus of praise in the Omnissiah’s name.|<span class="tooltip00340" data-tooltip-content="#tooltip_content00340" data-tooltip-anchor="#tooltip_content00340"><span class="kwb kwbu">LEGIO</span> <span class="kwb kwbu">CYBERNETICA</span></span> units from your army gain the <span class="tooltip00337" data-tooltip-content="#tooltip_content00337"><span class="tt kwbu">Doctrina</span> <span class="tt kwbu">Imperatives</span></span> army rule |Cohort Cybernetica|
000009280|AdM|Overload Machine Spirits|In extremis, Tech-Magi will commit the lesser sin of goading lower-order machine spirits to devastating madness in order to protect greater prizes.|Each time an <span class="kwb">ADEPTUS</span> <span class="kwb">MECHANICUS</span> unit from your army is selected to shoot, it can use this ability. If it does, until the end of the phase, improve the Armour Penetration characteristic of ranged weapons equipped by models in that unit by 1 and those weapons have the <span class="kwb2 bluefont"><span class="tooltip00028" data-tooltip-content="#tooltip_content00028"><span class="tt kwbu">[HAzARDOUS]</span></span></span> ability.|Electromartyrs|
000009289|AdM|Procedural Elimination|Triangulating via their fellow squads and any compliant shipboard augurs, the Skitarii hone their targeting data and overlap fields of fire.|At the start of the <a href="/wh40k10ed/the-rules/core-rules/#The-Battle-Round">battle round</a>, select either melee attacks or ranged attacks. Until the end of the battle round, each time a <span class="tooltip00303" data-tooltip-content="#tooltip_content00303" data-tooltip-anchor="#tooltip_content00303"><span class="kwb kwbu">SKITARII</span></span> model from your army makes an attack of the selected type, re-roll a <span class="tooltip00011" data-tooltip-content="#tooltip_content00011"><span class="tt kwbu">Hit</span> <span class="tt kwbu">roll</span></span> of l.|Response Clade|
000009297|AdM|Canticles of the Omnissiah|Chanting avidly in blaring binharic, the servants of the Omnissiah surge into battle as though possessed by wrathful datagheists.|Add 1 to <span class="tooltip00007" data-tooltip-content="#tooltip_content00007"><span class="tt kwbu">Advance</span> <span class="tt kwbu">rolls</span></span>, <span class="tooltip00009" data-tooltip-content="#tooltip_content00009"><span class="tt kwbu">Charge</span> <span class="tt kwbu">rolls</span></span> and <span class="tooltip00021" data-tooltip-content="#tooltip_content00021"><span class="tt kwbu">Battle-shock</span> <span class="tt kwbu">tests</span></span> taken for <span class="tooltip00266" data-tooltip-content="#tooltip_content00266" data-tooltip-anchor="#tooltip_content00266"><span class="kwb kwbu">TECH-PRIEST</span></span> and <span class="tooltip00263" data-tooltip-content="#tooltip_content00263" data-tooltip-anchor="#tooltip_content00263"><span class="kwb kwbu">ELECTRO-PRIESTS</span></span> units from your army.|Machine Cult|
000009744|AdM|Noospheric Transference|Tech-Priests can override the will of their thralls and project martial data inloads into the minds of their warriors, blessing the soldiery with endless streams of precisely tailored binharic code.|In your <a href="/wh40k10ed/the-rules/core-rules/#COMMAND-PHASE">Command phase</a>, select one or more <span class="kwb">ADEPTUS</span> <span class="kwb">MECHANICUS</span> units from your army (including units that are <span class="tooltip00027" data-tooltip-content="#tooltip_content00027"><span class="tt kwbu">embarked</span></span> within <span class="tooltip00338" data-tooltip-content="#tooltip_content00338" data-tooltip-anchor="#tooltip_content00338"><span class="kwb kwbu">TRANSPORTS</span></span>). The maximum number of units you can select depends on the battle size, as follows:<br><br><div class="BreakInsideAvoid"  style="""><table border="0" bordercolor="#888" cellpadding="4" cellspacing="0" style="border-collapse:collapse;border-width:0px"><tbody><tr><td><table class=" customTable tablefont" border="1" bordercolor="#888" cellpadding="4" style="border-collapse:collapse;border-color:#888888;border-width:0px"><tbody><tr><td style="border-width:0 0 0 0;border-style:none none none none;vertical-align:bottom;font-size:24px;width:147px;height:0px;"><b>INCURSION:</b></td><td style="border-width:0 0 0 0;border-style:none none none none;vertical-align:bottom;font-size:24px;width:87px;height:0px;"><b>1 UNIT</b></td></tr><tr><td style="border-width:0 0 0 0;border-style:none none none none;vertical-align:bottom;font-size:24px;width:147px;height:0px;"><b>STRIKE FORCE</b></td><td style="border-width:0 0 0 0;border-style:none none none none;vertical-align:bottom;font-size:24px;width:87px;height:0px;"><b>2 UNITS</b></td></tr><tr><td style="border-width:0 0 0 0;border-style:none none none none;vertical-align:bottom;font-size:24px;width:147px;height:0px;"><b>ONSLAUGHT</b></td><td style="border-width:0 0 0 0;border-style:none none none none;vertical-align:bottom;font-size:24px;width:87px;height:0px;"><b>3 UNITS</b></td></tr></tbody></table></td></tr></tbody></table></div><br>Until the start of your next Command phase, those units gain the <span class="kwb">HALO</span> <span class="kwb">OVERRIDE</span> keyword. Then, select one of the Override abilities below. Until the start of your next Command phase, units from your army with the <span class="kwb">HALO</span> <span class="kwb">OVERRIDE</span> keyword have the selected Override ability:<br><br><span class="h_custom">Electromotive Energisation</span><br>Add 2" to the Move characteristic of models in this unit.<br><br><span class="h_custom">Microactuator Bracing</span><br>Add 1 to the Toughness characteristic of models in this unit.<br><br><span class="h_custom">Predation Protocols</span><br>This unit is eligible to <a href="/wh40k10ed/the-rules/core-rules/#CHARGE-PHASE">declare a charge</a> in a turn in which it <span class="tooltip00007" data-tooltip-content="#tooltip_content00007"><span class="tt kwbu">Advanced</span></span>.<br><br><span class="h_custom">Muted Servomotors</span><br>Models in this unit have the <span class="tooltip00096" data-tooltip-content="#tooltip_content00096"><span class="tt kwbu">Stealth</span></span> ability.|Haloscreed Battle Clade|
000009324|AE|Unerring Strike|Once loosed at their target, the warriors who make up the Arrow of Khaine focus all of their attentions upon their singular target, ’[hey move with all the balletic speed of their people, and let nothing slow their attack.|In your <a href="/wh40k10ed/the-rules/boarding-action-rules/#Movement-Phase">Movement phase</a>, each time an <span class="kwb">AELDARI</span> unit from your army makes a <span class="tooltip00006" data-tooltip-content="#tooltip_content00006"><span class="tt kwbu">Normal</span> <span class="tt kwbu">move</span></span>, while making that move it can attempt to operate a closed <a href="/wh40k10ed/the-rules/boarding-action-rules/#Terrain">Hatchway</a> that is within 1" of it at any point during that move, provided there are no enemy units within 1" of that Hatchway. If that <span class="kwb">AELDARI</span> unit does attempt to operate that Hatchway, reduce the distance each model in that unit can move this phase by 2" (if this makes it impossible for that unit to gel within 1" of that Hatchway it wishes to operate, then it cannot attempt to do so), and it cannot <a href="/wh40k10ed/the-rules/boarding-action-rules/#Open-Hatchways">operate a Hatchway</a> again this turn.|Khaine’s Arrow|
