id|faction_id|name|legend|description|detachment|
000009622|ORK|Comin’ Through|Very little can prevent a hulking Ork from smashing a path through a voidship’s decks to wherever he is trying to go. It is generally considered deeply unwise bordering on suicidal to try...|In your <a href="/wh40k10ed/the-rules/boarding-action-rules/#Movement-Phase">Movement phase</a>, <span class="tooltip00008" data-tooltip-content="#tooltip_content00008"><span class="tt kwbu">Desperate</span> <span class="tt kwbu">Escape</span> <span class="tt kwbu">tests</span></span> taken for <span class="kwb">ORKS</span> models from your army are automatically passed and each time an <span class="kwb">ORKS</span> unit from your army makes a <span class="tooltip00006" data-tooltip-content="#tooltip_content00006"><span class="tt kwbu">Normal</span></span>, <span class="tooltip00007" data-tooltip-content="#tooltip_content00007"><span class="tt kwbu">Advance</span></span> or <span class="tooltip00008" data-tooltip-content="#tooltip_content00008"><span class="tt kwbu">Fall</span> <span class="tt kwbu">Back</span> <span class="tt kwbu">move</span></span>, it can move through other models as if they were not there, provided those other models have a lower Toughness characteristic than it.|Kaptin Killers|
000009794|ORK|Lissen ’Ere|Blood Axe leaders bellow actual orders to the ladz under their command.|Once per <a href="/wh40k10ed/the-rules/core-rules/#The-Battle-Round">battle round</a>, in your <a href="/wh40k10ed/the-rules/core-rules/#COMMAND-PHASE">Command phase</a> or after being set up on the battlefield in your <a href="/wh40k10ed/the-rules/core-rules/#MOVEMENT-PHASE">Movement phase</a>, each <a class="kwbOne" href="/wh40k10ed/factions/orks/Boss-Snikrot"><span class="kwb kwbo">BOSS</span> <span class="kwb kwbo">SNIKROT</span></a>, <span class="tooltip00413" data-tooltip-content="#tooltip_content00413" data-tooltip-anchor="#tooltip_content00413"><span class="kwb kwbu">MEK</span></span> and <span class="tooltip00219" data-tooltip-content="#tooltip_content00219" data-tooltip-anchor="#tooltip_content00219"><span class="kwb kwbu">WARBOSS</span></span> model in your army can issue Taktiks abilities.<br><br>To do so, select one or two of the Taktiks abilities below and select one friendly <span class="kwb">ORKS</span> unit within 6" of that model to issue them to. If you selected two Taktiks, that model must take a <span class="tooltip00091" data-tooltip-content="#tooltip_content00091"><span class="tt kwbu">Leadership</span> <span class="tt kwbu">test</span></span>: if failed, the selected unit suffers D3 <span class="tooltip00047" data-tooltip-content="#tooltip_content00047"><span class="tt kwbu">mortal</span> <span class="tt kwbu">wounds</span></span>. Until the start of your next Command phase, the selected unit is affected by the selected Taktiks. A unit cannot have Taktiks issued to it in this way more than once per battle round.<br><br>Taktiks abilities cannot be issued to <span class="tooltip00021" data-tooltip-content="#tooltip_content00021"><span class="tt kwbu">Battle-shocked</span></span> units, and if a unit affected by Taktiks becomes Battle-shocked, all Taktiks cease to affect that unit while it is Battle-shocked.<br><br><b>Get Stuck In:</b> You can re-roll <span class="tooltip00009" data-tooltip-content="#tooltip_content00009"><span class="tt kwbu">Charge</span> <span class="tt kwbu">rolls</span></span> made for this unit.<br><br><b>Get On Wiv It:</b> Add 1 to the Strength characteristic of melee weapons equipped by models in this unit.<br><br><b>Sneaky Stalkin’:</b> <span class="tooltip00421" data-tooltip-content="#tooltip_content00421" data-tooltip-anchor="#tooltip_content00421"><span class="kwb kwbu">INFANTRY</span></span> and <span class="tooltip00422" data-tooltip-content="#tooltip_content00422" data-tooltip-anchor="#tooltip_content00422"><span class="kwb kwbu">MOUNTED</span></span> models (excluding <a class="kwbOne" href="/wh40k10ed/factions/orks/Meganobz"><span class="kwb kwbo">MEGANOBZ</span></a>) in this unit have the <span class="tooltip00096" data-tooltip-content="#tooltip_content00096"><span class="tt kwbu">Stealth</span></span> ability and each time a ranged attack targets this unit, those models have the <span class="tooltip00043" data-tooltip-content="#tooltip_content00043"><span class="tt kwbu">Benefit</span> <span class="tt kwbu">of</span> <span class="tt kwbu">Cover</span></span> against that attack.<br><br><b>Shoota Drills:</b> Each time an <span class="kwb">INFANTRY</span> or <span class="kwb">MOUNTED</span> model in this unit makes a ranged attack, add 1 to the <span class="tooltip00011" data-tooltip-content="#tooltip_content00011"><span class="tt kwbu">Hit</span> <span class="tt kwbu">roll</span></span>.<br><br><span class="hi_custom">KEYWORDS</span><br><a class="kwbOne" href="/wh40k10ed/factions/orks/Stormboyz"><span class="kwb kwbo">STORMBOYZ</span></a> units from your army gain the <span class="tooltip00423" data-tooltip-content="#tooltip_content00423" data-tooltip-anchor="#tooltip_content00423"><span class="kwb kwbu">BATTLELINE</span></span> keyword.|Taktikal Brigade|
000008463|QI|Indomitable Heroes|Gathered into a powerful formation known as a lance, Imperial Knights and the Nobles who pilot them wage their honour-driven assaults with renowned resilience and bloody-minded determination.|All <span class="kwb">IMPERIAL</span> <span class="kwb">KNIGHTS</span> models from your army have the <span class="tooltip00073" data-tooltip-content="#tooltip_content00073"><span class="tt kwbu">Feel</span> <span class="tt kwbu">No</span> <span class="tt kwbu">Pain</span> <span class="tt kwbu">6+</span></span> ability. If your army is <span class="tooltip00426" data-tooltip-content="#tooltip_content00426"><span class="tt kwbu">Honoured</span></span>, those models have the <span class="tooltip00073" data-tooltip-content="#tooltip_content00073"><span class="tt kwbu">Feel</span> <span class="tt kwbu">No</span> <span class="tt kwbu">Pain</span> <span class="tt kwbu">5+</span></span> ability.|Noble Lance|
000009760|QI|Cogbound Alliance|The Nobles of Questor Mechanicus houses commonly fight alongside the armies of forge worlds. They are bound together by their shared devotion to the Machine Cult.|<span class="tooltip00431" data-tooltip-content="#tooltip_content00431" data-tooltip-anchor="#tooltip_content00431"><span class="kwb kwbu">IMPERIAL</span> <span class="kwb kwbu">KNIGHTS</span></span> units from your army have the following the ability:<br><br><b>Sacristan Pledge:</b> In your <a href="/wh40k10ed/the-rules/core-rules/#COMMAND-PHASE">Command phase</a>, one model in this unit regains 1 lost wound. If this unit is within 3" of one or more friendly <span class="tooltip00430" data-tooltip-content="#tooltip_content00430" data-tooltip-anchor="#tooltip_content00430"><span class="kwb kwbu">TECH-PRIEST</span></span> models, one model in this unit regains up to D3 lost wounds instead.<br><br><span class="tooltip00427" data-tooltip-content="#tooltip_content00427" data-tooltip-anchor="#tooltip_content00427"><span class="kwb kwbu">ADEPTUS</span> <span class="kwb kwbu">MECHANICUS</span></span> units from your army have the following ability:<br><br><b>Divine Inspiration:</b> Each time a model in this unit makes a ranged attack, re-roll a <span class="tooltip00011" data-tooltip-content="#tooltip_content00011"><span class="tt kwbu">Hit</span> <span class="tt kwbu">roll</span></span> of 1. If this unit is within 6" of one or more friendly <span class="kwb">IMPERIAL</span> <span class="kwb">KNIGHTS</span> units, re-roll a <span class="tooltip00023" data-tooltip-content="#tooltip_content00023"><span class="tt kwbu">Wound</span> <span class="tt kwbu">roll</span></span> of 1 as well.<br><br><span class="hi_custom">FORGE WORLD ALLIES</span><br>You can include the following <span class="kwb">ADEPTUS</span> <span class="kwb">MECHANICUS</span> units in your army: <a class="kwbOne" href="/wh40k10ed/factions/imperial-knights/Tech-priest-Dominus"><span class="kwb kwbo">TECH-PRIEST</span> <span class="kwb kwbo">DOMINUS</span></a>; <a class="kwbOne" href="/wh40k10ed/factions/imperial-knights/Tech-priest-Manipulus"><span class="kwb kwbo">TECH-PRIEST</span> <span class="kwb kwbo">MANIPULUS</span></a>; <a class="kwbOne" href="/wh40k10ed/factions/imperial-knights/Skitarii-Marshal"><span class="kwb kwbo">SKITARII</span> <span class="kwb kwbo">MARSHAL</span></a>; <a class="kwbOne" href="/wh40k10ed/factions/imperial-knights/Skitarii-Rangers"><span class="kwb kwbo">SKITARII</span> <span class="kwb kwbo">RANGERS</span></a>; <a class="kwbOne" href="/wh40k10ed/factions/imperial-knights/Skitarii-Vanguard"><span class="kwb kwbo">SKITARII</span> <span class="kwb kwbo">VANGUARD</span></a>. The combined points cost of such units depends on your battle size:<br><ul><li><b>Incursion:</b> Up to 250 pts</li><li><b>Strike Force:</b> Up to 500 pts</li><li><b>Onslaught:</b> Up to 750 pts</li></ul><br>No <span class="kwb">ADEPTUS</span> <span class="kwb">MECHANICUS</span> models from your army can be your <span class="kwb">WARLORD</span>.|Questor Forgepact|
000008518|QT|Forged in Terror (Aura)|Chaos Knights are servants of shadow and terror; wherever they stride, fear and madness spread.|In the <span class="tooltip00021" data-tooltip-content="#tooltip_content00021"><span class="tt kwbu">Battle-shock</span></span> step of your opponent’s <a href="/wh40k10ed/the-rules/core-rules/#COMMAND-PHASE">Command phase</a>, if an enemy unit that is below its <span class="tooltip00059" data-tooltip-content="#tooltip_content00059"><span class="tt kwbu">Starting</span> <span class="tt kwbu">Strength</span></span> is within 12" of a <span class="kwb">CHAOS</span> <span class="kwb">KNIGHTS</span> model from your army, that enemy unit must take a Battleshock test. For the purposes of this ability, if a unit has a Starting Strength of 1, it is considered to be below its Starting Strength while it has lost one or more wounds.<br><br><b>Designer’s Note:</b> <i>This means that all enemy units within range of this <span class="tooltip00383" data-tooltip-content="#tooltip_content00383"><span class="tt kwbu">Aura</span> <span class="tt kwbu">ability</span></span> that have lost one or more models must take a <span class="tooltip00021" data-tooltip-content="#tooltip_content00021"><span class="tt kwbu">Battle-shock</span> <span class="tt kwbu">test</span></span> in your opponent’s Command phase, not just those that are <span class="tooltip00053" data-tooltip-content="#tooltip_content00053"><span class="tt kwbu">Below</span> <span class="tt kwbu">Half-strength</span></span>.</i>|Traitoris Lance|
000009764|QT|Dreaded Masters|Mortal thralls and foes alike are sacrificed to empower the fallen nobility.|<span class="tooltip00509" data-tooltip-content="#tooltip_content00509" data-tooltip-anchor="#tooltip_content00509"><span class="kwb kwbu">TITANIC</span> <span class="kwb kwbu">CHAOS</span> <span class="kwb kwbu">KNIGHTS</span></span> units from your army have the following abilities:<br><br><b>Dread Tyrants (Aura):</b> While a friendly <span class="tooltip00432" data-tooltip-content="#tooltip_content00432" data-tooltip-anchor="#tooltip_content00432"><span class="kwb kwbu">DAMNED</span></span> unit is within 9" of this unit, each time a model in that unit makes an attack, re-roll a <span class="tooltip00011" data-tooltip-content="#tooltip_content00011"><span class="tt kwbu">Hit</span> <span class="tt kwbu">roll</span></span> of 1 and re-roll a <span class="tooltip00023" data-tooltip-content="#tooltip_content00023"><span class="tt kwbu">Wound</span> <span class="tt kwbu">roll</span></span> of 1.<br><br><span class="tooltip00510" data-tooltip-content="#tooltip_content00510" data-tooltip-anchor="#tooltip_content00510"><span class="kwb kwbu">CHAOS</span> <span class="kwb kwbu">KNIGHTS</span></span> units from your army have the following abilities:<br><br><b>Dark Sacrifice:</b> Each time a <span class="kwb">CHAOS</span> <span class="kwb">KNIGHTS</span> unit with this ability is selected to shoot or fight, it can make a Dark Sacrifice. If it does, select one friendly <span class="kwb">DAMNED</span> unit within 6". That <span class="kwb">DAMNED</span> unit must take a <span class="tooltip00091" data-tooltip-content="#tooltip_content00091"><span class="tt kwbu">Leadership</span> <span class="tt kwbu">test</span></span>: if passed, destroy D3 models in that <span class="kwb">DAMNED</span> unit; if failed, destroy D3+3 models in that <span class="kwb">DAMNED</span> unit. In either case, then select one of the following abilities for your <span class="kwb">CHAOS</span> <span class="kwb">KNIGHTS</span> unit’s weapons to have until the end of the phase: <span class="kwb2 bluefont"><span class="tooltip00064" data-tooltip-content="#tooltip_content00064"><span class="tt kwbu">[LETHAL</span> <span class="tt kwbu">HITS]</span></span></span>; <span class="kwb2 bluefont"><span class="tooltip00033" data-tooltip-content="#tooltip_content00033"><span class="tt kwbu">[SUSTAINED</span> <span class="tt kwbu">HITS</span> <span class="tt kwbu">1]</span></span></span>.<br><br><span class="hi_custom">WRETCHED THRALLS</span><br>You can include <span class="tooltip00432" data-tooltip-content="#tooltip_content00432" data-tooltip-anchor="#tooltip_content00432"><span class="kwb kwbu">DAMNED</span></span> units in your army (see Codex: <a href="/wh40k10ed/factions/chaos-space-marines">Chaos Space Marines</a>). The combined points cost of such units depends on your battle size:<br><ul><li><b>Incursion:</b> Up to 250 pts</li><li><b>Strike Force:</b> Up to 500 pts</li><li><b>Onslaught:</b> Up to 750 pts</li></ul><br>No <span class="kwb">DAMNED</span> models from your army can be your <span class="kwb">WARLORD</span>.|Iconoclast Fiefdom|
000008355|SM|Combat Doctrines|The Codex Astartes has proven its worth as a superb treatise on warfare over countless battlefields, and has remained so even after ten thousand years. Many Space Marines hold its wisdom in awe, and exemplify its teachings, employing a flexible set of combat doctrines to eliminate their enemy. Few opponents can withstand the fury of such an onslaught.|At the start of your <a href="/wh40k10ed/the-rules/core-rules/#COMMAND-PHASE">Command phase</a>, you can select one of the Combat Doctrines listed below. Until the start of your next Command phase, that Combat Doctrine is active and its effects apply to all <span class="kwb">ADEPTUS</span> <span class="kwb">ASTARTES</span> units from your army. You can only select each Combat Doctrine once per battle.<div style="height:8px"></div><div class="BreakInsideAvoid"><table max-width="480px" border="0" cellpadding="3" style="border-width:0px"><tbody><tbody><tr><td><p style="display:block" class="impact18">Devastator Doctrine</p><p class="ShowFluff legend2">The Codex Astartes details the strategic value of overwhelming firepower applied to key targets while advancing into position to eliminate threats.</p><p>This unit is eligible to shoot in a turn in which it <span class="tooltip00007" data-tooltip-content="#tooltip_content00007"><span class="tt kwbu">Advanced</span></span>.</p></td></tr></tbody></tbody></table></div><div class="BreakInsideAvoid"><table max-width="480px" border="0" cellpadding="3" style="border-width:0px"><tbody><tbody><tr><td><p style="display:block" class="impact18">Tactical Doctrine</p><p class="ShowFluff legend2">As the warring armies close upon one another and vicious fire-fights erupt, the Codex lays out strategies for swiftly seizing the initiative and combining versatility with firepower.</p><p>This unit is eligible to shoot and <a href="/wh40k10ed/the-rules/core-rules/#CHARGE-PHASE">declare a charge</a> in a turn in which it <span class="tooltip00008" data-tooltip-content="#tooltip_content00008"><span class="tt kwbu">Fell</span> <span class="tt kwbu">Back</span></span>.</p></td></tr></tbody></tbody></table></div><div class="BreakInsideAvoid"><table max-width="480px" border="0" cellpadding="3" style="border-width:0px"><tbody><tbody><tr><td><p style="display:block" class="impact18">Assault Doctrine</p><p class="ShowFluff legend2">The Codex Astartes leaves no doubt that the killing blow in most engagements must be delivered with a decisive close-quarters strike. It presents plentiful tactical means to achieve this end.</p><p>This unit is eligible to <a href="/wh40k10ed/the-rules/core-rules/#CHARGE-PHASE">declare a charge</a> in a turn in which it <span class="tooltip00007" data-tooltip-content="#tooltip_content00007"><span class="tt kwbu">Advanced</span></span>.</p></td></tr></tbody></tbody></table></div>|Gladius Task Force|
000008374|SM|Red Thirst|Though they strive to restrain it, the murderous ferocity of the Blood Angels simmers beneath the surface of their thoughts. In battle, this rage drives them towards the foe and lends great strength to their blows.|Each time an <span class="kwb">ADEPTUS</span> <span class="kwb">ASTARTES</span> unit from your army is selected to fight, if that unit made a <span class="tooltip00009" data-tooltip-content="#tooltip_content00009"><span class="tt kwbu">Charge</span> <span class="tt kwbu">move</span></span> this turn, until the end of the phase, add 1 to the Attacks characteristic and add 2 to the Strength characteristic of melee weapons equipped by models in that unit.<br><br><span class="hi_custom">RESTRICTIONS</span><br>Your army can include <span class="kwb">BLOOD</span> <span class="kwb">ANGELS</span> units, but it cannot include any <span class="kwb">ADEPTUS</span> <span class="kwb">ASTARTES</span> units drawn from any other Chapter.|Liberator Assault Group|
000008473|SM|Shield of the Imperium|Across blood-drenched battlefields, within towering citadels and isolated orbital stations, the Angels of Death throw back tides of traitors, mutants, xenos and heretics, and purge enemy holdings of foes thanks to their disciplined strategies and fighting skills. All who oppose them are met with volleys of deadly accurate firepower long before they reach the battle-brothers’ razor-sharp blades.|Ranged weapons equipped by <span class="kwb">ADEPTUS</span> <span class="kwb">ASTARTES</span> models from your army have the <span class="kwb2 bluefont"><span class="tooltip00098" data-tooltip-content="#tooltip_content00098"><span class="tt kwbu">[HEAVY]</span></span></span> ability. If such a weapon already has this ability, each time an attack is made with that weapon, if the attacking model’s unit <span class="tooltip00346" data-tooltip-content="#tooltip_content00346"><span class="tt kwbu">Remained</span> <span class="tt kwbu">Stationary</span></span> this turn, add 1 to the <span class="tooltip00023" data-tooltip-content="#tooltip_content00023"><span class="tt kwbu">Wound</span> <span class="tt kwbu">roll</span></span>.|Anvil Siege Force|
000008477|SM|Armoured Wrath|An Ironstorm Spearhead’s commanders guide their assault with pre-cogitated fire solutions, cycling data-gheist inloads and whispered binharic auguries. These ensure their warriors, and the belligerent machine spirits inhabiting their war engines, deliver their fire with inescapable accuracy.|Once per phase for each <span class="kwb">ADEPTUS</span> <span class="kwb">ASTARTES</span> unit in your army, you can re-roll one <span class="tooltip00011" data-tooltip-content="#tooltip_content00011"><span class="tt kwbu">Hit</span> <span class="tt kwbu">roll</span></span>, one <span class="tooltip00023" data-tooltip-content="#tooltip_content00023"><span class="tt kwbu">Wound</span> <span class="tt kwbu">roll</span></span> or one Damage roll made for a model in that unit.|Ironstorm Spearhead|
000008481|SM|Close-range Eradication|The Space Marines are the Emperor’s finest shock troops, striking at the foe before they can react. In their rapid, mechanised assaults, Space Marines smash aside the enemy, destroying them at close quarters without mercy.|Ranged weapons equipped by <span class="kwb">ADEPTUS</span> <span class="kwb">ASTARTES</span> models from your army have the <span class="kwb2 bluefont"><span class="tooltip00077" data-tooltip-content="#tooltip_content00077"><span class="tt kwbu">[ASSAULT]</span></span></span> ability, and each time an attack made with such a weapon targets a unit within 12", add 1 to the Strength characteristic of that attack.|Firestorm Assault Force|
000008485|SM|Lightning Assault|The warriors of a Stormlance Task Force employ high-speed tactics and hit-and-run warfare. They do battle on the move, wrong-footing their enemies with breakneck manoeuvres and melting away one moment only to crash home like a thunderbolt the next.|<span class="kwb">ADEPTUS</span> <span class="kwb">ASTARTES</span> units from your army are eligible to <a href="/wh40k10ed/the-rules/core-rules/#CHARGE-PHASE">declare a charge</a> in a turn in which they <span class="tooltip00007" data-tooltip-content="#tooltip_content00007"><span class="tt kwbu">Advanced</span></span> or <span class="tooltip00008" data-tooltip-content="#tooltip_content00008"><span class="tt kwbu">Fell</span> <span class="tt kwbu">Back</span></span>.|Stormlance Task Force|
000008489|SM|Shadow Masters|The warriors of a Vanguard Spearhead slip through the shadows, half-seen spectres barely visible to the foe. Enemies blaze away into the gloom with increasing panic, their shots flying wide as covert specialists encircle their victims and prepare to level the killing blow.|Each time a ranged attack targets an <span class="kwb">ADEPTUS</span> <span class="kwb">ASTARTES</span> unit from your army, unless the attacking model is within 12", subtract 1 from the <span class="tooltip00011" data-tooltip-content="#tooltip_content00011"><span class="tt kwbu">Hit</span> <span class="tt kwbu">roll</span></span> and the target has the <span class="tooltip00043" data-tooltip-content="#tooltip_content00043"><span class="tt kwbu">Benefit</span> <span class="tt kwbu">of</span> <span class="tt kwbu">Cover</span></span> against that attack.|Vanguard Spearhead|
000008493|SM|Extremis-level Threat|The 1st Company’s veterans have fought at the forefront of their Chapter’s wars for many mortal lifespans. Experience has taught them to identify the foe’s lethal threats and to lead their battle-brothers to purge them from existence.|Once per battle, in your <a href="/wh40k10ed/the-rules/core-rules/#COMMAND-PHASE">Command phase</a>, you can use this ability. If you do, until the start of your next Command phase, each time a model from your army with the <span class="tooltip00222" data-tooltip-content="#tooltip_content00222"><span class="tt kwbu">Oath</span> <span class="tt kwbu">of</span> <span class="tt kwbu">Moment</span></span> ability makes an attack that targets your Oath of Moment target, you can re-roll the <span class="tooltip00023" data-tooltip-content="#tooltip_content00023"><span class="tt kwbu">Wound</span> <span class="tt kwbu">roll</span></span> as well.|1st Company Task Force|
